{
  "version": "1.0",
  "title": "Команды Twitch-чата",
  "description": "Список доступных команд стрима по категориям.",
  "lastUpdated": "2026-06-12",
  "categories": [
    {
      "id": "basic",
      "name": "Основные",
      "commands": [
        {
          "triggers": ["!клип", "!clip"],
          "description": "создать клип"
        },
        {
          "triggers": ["!watchstreak", "!стрикпросмотров"],
          "description": "зритель с наибольшим стриком просмотров"
        },
        {
          "triggers": ["!deaths", "!смерти"],
          "description": "список смертей в игре"
        },
        {
          "triggers": ["!deathboard", "!таблицасмертей"],
          "description": "таблица смертей по играм"
        },
        {
          "triggers": ["!totaldeaths", "!всегосмертей"],
          "description": "всего смертей в играх"
        }
      ]
    },
    {
      "id": "fun",
      "name": "Fun",
      "commands": [
        {
          "triggers": ["!см", "!cm"],
          "description": "узнать сантиметры"
        },
        {
          "triggers": ["!рулетка", "!roulette"],
          "description": "испытать удачу"
        }
      ]
    },
    {
      "id": "jeetbot",
      "name": "JeetBot",
      "commands": [
        {
          "triggers": ["!uptime"],
          "description": "показывает время стрима"
        },
        {
          "triggers": ["!shazam", "!трек", "!песня"],
          "description": "распознает текущую песню"
        },
        {
          "triggers": ["!top", "!топ"],
          "description": "показывает топ 10 по сообщениям в чате"
        },
        {
          "triggers": ["!topday", "!топдня"],
          "description": "показывает топ 10 по сообщениям за сегодня"
        },
        {
          "triggers": ["!tts", "!озвучка"],
          "description": "выбрать голос для озвучки"
        },
        {
          "triggers": ["!usertop"],
          "description": "показывает ранг в топе сообщений"
        },
        {
          "triggers": ["!myfirst"],
          "description": "показывает первое сообщение в чате"
        },
        {
          "triggers": ["!ttsvoice"],
          "description": "показывает текущий выбранный голос"
        },
        {
          "triggers": ["!ups", "!упс"],
          "description": "позволяет удалить последнее сообщение, отправленное пользователем"
        }
      ]
    }
  ]
}
